UNIPROT,has,description
up:P11177,hsa:5162,PDHB; pyruvate dehydrogenase E1 subunit beta
up:Q9UIL1,hsa:60592,SCOC; short coiled-coil protein
up:O95219,hsa:8723,SNX4; sorting nexin 4
up:Q92845,hsa:22920,KIFAP3; kinesin associated protein 3
up:Q96FW1,hsa:55611,"OTUB1; OTU deubiquitinase, ubiquitin aldehyde binding 1"
up:P09471,hsa:2775,GNAO1; G protein subunit alpha o1
up:Q69YW2,hsa:375057,"STUM; stum, mechanosensory transduction mediator homolog"
up:P00505,hsa:2806,GOT2; glutamic-oxaloacetic transaminase 2
up:P19623,hsa:6723,SRM; spermidine synthase
up:Q8TB36,hsa:54332,GDAP1; ganglioside induced differentiation associated protein 1
up:Q70HW3,hsa:115286,SLC25A26; solute carrier family 25 member 26
up:Q8N594,hsa:84954,MPND; MPN domain containing
up:Q8N6D5,hsa:147463,ANKRD29; ankyrin repeat domain 29
up:P09958,hsa:5045,"FURIN; furin, paired basic amino acid cleaving enzyme"
up:P16219,hsa:35,ACADS; acyl-CoA dehydrogenase short chain
up:P09622,hsa:1738,DLD; dihydrolipoamide dehydrogenase
up:P06744,hsa:2821,GPI; glucose-6-phosphate isomerase
up:P40939,hsa:3030,HADHA; hydroxyacyl-CoA dehydrogenase trifunctional multienzyme complex subunit alpha
up:P15259,hsa:5224,PGAM2; phosphoglycerate mutase 2
up:P00558,hsa:5230,PGK1; phosphoglycerate kinase 1
up:P60174,hsa:7167,TPI1; triosephosphate isomerase 1
up:Q96RN5,hsa:51586,MED15; mediator complex subunit 15
up:Q9C040,hsa:23321,TRIM2; tripartite motif containing 2
up:O75534,hsa:7812,CSDE1; cold shock domain containing E1
up:P50995,hsa:311,ANXA11; annexin A11
up:Q86X27,hsa:55103,RALGPS2; Ral GEF with PH domain and SH3 binding motif 2
up:Q14117,hsa:1807,DPYS; dihydropyrimidinase
up:P06733,hsa:2023,ENO1; enolase 1
up:P02794,hsa:2495,FTH1; ferritin heavy chain 1
up:P04406,hsa:2597,GAPDH; glyceraldehyde-3-phosphate dehydrogenase
up:P63096,hsa:2770,GNAI1; G protein subunit alpha i1
up:P36969,hsa:2879,GPX4; glutathione peroxidase 4
up:P10644,hsa:5573,PRKAR1A; protein kinase cAMP-dependent type I regulatory subunit alpha
up:P61019,hsa:5862,"RAB2A; RAB2A, member RAS oncogene family"
up:P25705,hsa:498,ATP5F1A; ATP synthase F1 subunit alpha
up:O43581,hsa:9066,SYT7; synaptotagmin 7
up:Q15019,hsa:4735,SEPTIN2; septin 2
up:P48547,hsa:3746,KCNC1; potassium voltage-gated channel subfamily C member 1
up:P02545,hsa:4000,LMNA; lamin A/C
up:P11217,hsa:5837,"PYGM; glycogen phosphorylase, muscle associated"
up:Q13976,hsa:5592,PRKG1; protein kinase cGMP-dependent 1
up:O43837,hsa:3420,IDH3B; isocitrate dehydrogenase (NAD(+)) 3 non-catalytic subunit beta
up:Q99497,hsa:11315,PARK7; Parkinsonism associated deglycase
up:P30044,hsa:25824,PRDX5; peroxiredoxin 5
up:O95858,hsa:23555,TSPAN15; tetraspanin 15
up:Q6NYC1,hsa:23210,"JMJD6; jumonji domain containing 6, arginine demethylase and lysine hydroxylase"
up:Q8WW12,hsa:57092,PCNP; PEST proteolytic signal containing nuclear protein
up:O15162,hsa:5359,PLSCR1; phospholipid scramblase 1
up:Q9Y5R8,hsa:58485,TRAPPC1; trafficking protein particle complex subunit 1
up:Q9BQ89,hsa:83541,FAM110A; family with sequence similarity 110 member A
up:P00167,hsa:1528,CYB5A; cytochrome b5 type A
up:Q8IZ83,hsa:126133,ALDH16A1; aldehyde dehydrogenase 16 family member A1
up:P59282,hsa:122664,TPPP2; tubulin polymerization promoting protein family member 2
up:Q8IUR0,hsa:126003,TRAPPC5; trafficking protein particle complex subunit 5
up:Q8NB37,hsa:347862,GATD1; glutamine amidotransferase class 1 domain containing 1
up:Q7Z6J6,hsa:84978,FRMD5; FERM domain containing 5
up:Q9Y4B5,hsa:23255,MTCL1; microtubule crosslinking factor 1
up:P31512,hsa:2329,FMO4; flavin containing dimethylaniline monoxygenase 4
up:Q9NQZ8,hsa:58491,ZNF71; zinc finger protein 71
up:P56470,hsa:3960,LGALS4; galectin 4
up:Q96PR1,hsa:3747,KCNC2; potassium voltage-gated channel subfamily C member 2
up:P07108,hsa:1622,"DBI; diazepam binding inhibitor, acyl-CoA binding protein"
up:Q9NZF1,hsa:51316,PLAC8; placenta associated 8
up:Q13227,hsa:2874,GPS2; G protein pathway suppressor 2
up:P26378,hsa:1996,ELAVL4; ELAV like RNA binding protein 4
up:P61204,hsa:377,ARF3; ADP ribosylation factor 3
up:P40925,hsa:4190,MDH1; malate dehydrogenase 1
up:Q8NC96,hsa:25977,NECAP1; NECAP endocytosis associated 1
up:P99999,hsa:54205,"CYCS; cytochrome c, somatic"
up:Q9NUL3,hsa:27067,STAU2; staufen double-stranded RNA binding protein 2
up:P08237,hsa:5213,"PFKM; phosphofructokinase, muscle"
up:Q02750,hsa:5604,MAP2K1; mitogen-activated protein kinase kinase 1
up:O75896,hsa:11334,"TUSC2; tumor suppressor 2, mitochondrial calcium regulator"
up:Q99747,hsa:8774,NAPG; NSF attachment protein gamma
up:Q96F85,hsa:25927,CNRIP1; cannabinoid receptor interacting protein 1
up:O00399,hsa:10671,DCTN6; dynactin subunit 6
up:P24666,hsa:52,ACP1; acid phosphatase 1
up:P00492,hsa:3251,HPRT1; hypoxanthine phosphoribosyltransferase 1
up:P63104,hsa:7534,YWHAZ; tyrosine 3-monooxygenase/tryptophan 5-monooxygenase activation protein zeta
up:Q6ZQX7,hsa:400566,C17orf97; chromosome 17 open reading frame 97
up:Q01581,hsa:3157,HMGCS1; 3-hydroxy-3-methylglutaryl-CoA synthase 1
up:Q8TB36,hsa:54332,GDAP1; ganglioside induced differentiation associated protein 1
up:Q8IYI6,hsa:149371,EXOC8; exocyst complex component 8
up:P17612,hsa:5566,PRKACA; protein kinase cAMP-activated catalytic subunit alpha
up:Q92777,hsa:6854,SYN2; synapsin II
up:P05413,hsa:2170,FABP3; fatty acid binding protein 3
up:P40855,hsa:5824,PEX19; peroxisomal biogenesis factor 19
up:P20340,hsa:5870,"RAB6A; RAB6A, member RAS oncogene family"
up:P05166,hsa:5096,PCCB; propionyl-CoA carboxylase subunit beta
up:O14775,hsa:10681,GNB5; G protein subunit beta 5
up:Q9UK76,hsa:51155,JPT1; Jupiter microtubule associated homolog 1
up:Q16566,hsa:814,CAMK4; calcium/calmodulin dependent protein kinase IV
up:Q8N4V2,hsa:55530,SVOP; SV2 related protein
up:Q9GZP4,hsa:57095,PITHD1; PITH domain containing 1
up:Q9BTX7,hsa:79183,TTPAL; alpha tocopherol transfer protein like
up:Q9NZ45,hsa:55847,CISD1; CDGSH iron sulfur domain 1
up:P21695,hsa:2819,GPD1; glycerol-3-phosphate dehydrogenase 1
up:O95299,hsa:4705,NDUFA10; NADH:ubiquinone oxidoreductase subunit A10
up:P49821,hsa:4723,NDUFV1; NADH:ubiquinone oxidoreductase core subunit V1
up:Q9NUI1,hsa:26063,"DECR2; 2,4-dienoyl-CoA reductase 2"
up:P45954,hsa:36,ACADSB; acyl-CoA dehydrogenase short/branched chain
up:O75340,hsa:10016,PDCD6; programmed cell death 6
up:P26440,hsa:3712,IVD; isovaleryl-CoA dehydrogenase
up:A5PLN9,hsa:80006,TRAPPC13; trafficking protein particle complex subunit 13
up:Q86V88,hsa:145553,MDP1; magnesium dependent phosphatase 1
up:P63098,hsa:5534,"PPP3R1; protein phosphatase 3 regulatory subunit B, alpha"
up:Q86WC6,hsa:116729,PPP1R27; protein phosphatase 1 regulatory subunit 27
up:P09493,hsa:7168,TPM1; tropomyosin 1
up:Q96LB3,hsa:80173,IFT74; intraflagellar transport 74
up:P14324,hsa:2224,FDPS; farnesyl diphosphate synthase
up:O43614,hsa:3062,HCRTR2; hypocretin receptor 2
up:P06576,hsa:506,ATP5F1B; ATP synthase F1 subunit beta
up:P0DP25,hsa:808,CALM3; calmodulin 3
up:P0DP25,hsa:808,CALM3; calmodulin 3
up:P0DP25,hsa:808,CALM3; calmodulin 3
up:P0DP25,hsa:808,CALM3; calmodulin 3
up:P0DP25,hsa:808,CALM3; calmodulin 3
up:P0DP25,hsa:808,CALM3; calmodulin 3
up:P0DP25,hsa:808,CALM3; calmodulin 3
up:P0DP25,hsa:808,CALM3; calmodulin 3
up:P0DP25,hsa:808,CALM3; calmodulin 3
up:P48052,hsa:1358,CPA2; carboxypeptidase A2
up:P48730,hsa:1453,CSNK1D; casein kinase 1 delta
up:P52209,hsa:5226,PGD; phosphogluconate dehydrogenase
up:O14521,hsa:6392,SDHD; succinate dehydrogenase complex subunit D
up:Q01995,hsa:6876,TAGLN; transgelin
up:P78563,hsa:104,ADARB1; adenosine deaminase RNA specific B1
up:P56377,hsa:8905,AP1S2; adaptor related protein complex 1 subunit sigma 2
up:P13861,hsa:5576,PRKAR2A; protein kinase cAMP-dependent type II regulatory subunit alpha
up:Q8WUH2,hsa:9392,TGFBRAP1; transforming growth factor beta receptor associated protein 1
up:O95864,hsa:9415,FADS2; fatty acid desaturase 2
up:Q99714,hsa:3028,HSD17B10; hydroxysteroid 17-beta dehydrogenase 10
up:O43920,hsa:4725,NDUFS5; NADH:ubiquinone oxidoreductase subunit S5
up:P47756,hsa:832,CAPZB; capping actin protein of muscle Z-line subunit beta
up:O95169,hsa:4714,NDUFB8; NADH:ubiquinone oxidoreductase subunit B8
up:P29803,hsa:5161,PDHA2; pyruvate dehydrogenase E1 subunit alpha 2
up:P20264,hsa:5455,POU3F3; POU class 3 homeobox 3
up:P46459,hsa:4905,"NSF; N-ethylmaleimide sensitive factor, vesicle fusing ATPase"
up:Q16851,hsa:7360,UGP2; UDP-glucose pyrophosphorylase 2
up:O15228,hsa:8443,GNPAT; glyceronephosphate O-acyltransferase
up:Q13442,hsa:11333,PDAP1; PDGFA associated protein 1
up:Q8N0W4,hsa:57502,NLGN4X; neuroligin 4 X-linked
up:Q96DB5,hsa:51115,RMDN1; regulator of microtubule dynamics 1
up:Q9BPX1,hsa:51171,HSD17B14; hydroxysteroid 17-beta dehydrogenase 14
up:Q9Y5Z6,hsa:8708,"B3GALT1; beta-1,3-galactosyltransferase 1"
up:P25325,hsa:4357,MPST; mercaptopyruvate sulfurtransferase
up:Q9H2U2,hsa:27068,PPA2; inorganic pyrophosphatase 2
up:Q17RW2,hsa:255631,COL24A1; collagen type XXIV alpha 1 chain
up:Q9P0L0,hsa:9218,VAPA; VAMP associated protein A
up:Q08289,hsa:783,CACNB2; calcium voltage-gated channel auxiliary subunit beta 2
up:Q8WWL7,hsa:85417,CCNB3; cyclin B3
up:Q9ULI4,hsa:26153,KIF26A; kinesin family member 26A
up:P28715,hsa:2073,"ERCC5; ERCC excision repair 5, endonuclease"
up:P48544,hsa:3762,KCNJ5; potassium inwardly rectifying channel subfamily J member 5
up:P14618,hsa:5315,PKM; pyruvate kinase M1/2
up:O00622,hsa:3491,CCN1; cellular communication network factor 1
up:Q96P44,hsa:81578,COL21A1; collagen type XXI alpha 1 chain
up:P53602,hsa:4597,MVD; mevalonate diphosphate decarboxylase
up:Q96HF1,hsa:6423,SFRP2; secreted frizzled related protein 2
up:O95263,hsa:8622,PDE8B; phosphodiesterase 8B
up:P68106,hsa:2281,FKBP1B; FKBP prolyl isomerase 1B
up:O60500,hsa:4868,"NPHS1; NPHS1 adhesion molecule, nephrin"
up:O43252,hsa:9061,PAPSS1; 3'-phosphoadenosine 5'-phosphosulfate synthase 1
up:Q8TBJ5,hsa:55079,FEZF2; FEZ family zinc finger 2
up:Q9NSN8,hsa:54212,SNTG1; syntrophin gamma 1
up:Q9H6X4,hsa:80194,TMEM134; transmembrane protein 134
up:P08243,hsa:440,ASNS; asparagine synthetase (glutamine-hydrolyzing)
up:Q8N895,hsa:167465,ZNF366; zinc finger protein 366
up:Q13303,hsa:8514,KCNAB2; potassium voltage-gated channel subfamily A regulatory beta subunit 2
up:Q8N4Q0,hsa:284273,ZADH2; zinc binding alcohol dehydrogenase domain containing 2
up:Q9H2B2,hsa:6860,SYT4; synaptotagmin 4
up:P0DP25,hsa:808,CALM3; calmodulin 3
up:P0DP25,hsa:808,CALM3; calmodulin 3
up:P0DP25,hsa:808,CALM3; calmodulin 3
up:P19429,hsa:7137,"TNNI3; troponin I3, cardiac type"
up:Q15147,hsa:5332,PLCB4; phospholipase C beta 4
up:Q9HCR9,hsa:50940,PDE11A; phosphodiesterase 11A
up:Q5TCY1,hsa:84630,TTBK1; tau tubulin kinase 1
up:P41181,hsa:359,AQP2; aquaporin 2
up:Q8N9N7,hsa:255252,LRRC57; leucine rich repeat containing 57
up:Q96GK7,hsa:51011,FAHD2A; fumarylacetoacetate hydrolase domain containing 2A
up:P17568,hsa:4713,NDUFB7; NADH:ubiquinone oxidoreductase subunit B7
up:Q9UBK7,hsa:11159,"RABL2A; RAB, member of RAS oncogene family like 2A"
up:P13804,hsa:2108,ETFA; electron transfer flavoprotein subunit alpha
up:Q5VZ03,hsa:158046,NXNL2; nucleoredoxin like 2
up:P30988,hsa:799,CALCR; calcitonin receptor
up:P49189,hsa:223,ALDH9A1; aldehyde dehydrogenase 9 family member A1
up:Q96RW7,hsa:83872,HMCN1; hemicentin 1
up:P19404,hsa:4729,NDUFV2; NADH:ubiquinone oxidoreductase core subunit V2
up:O94903,hsa:11212,PLPBP; pyridoxal phosphate binding protein
up:Q9HCJ6,hsa:57687,VAT1L; vesicle amine transport 1 like
up:P82251,hsa:11136,SLC7A9; solute carrier family 7 member 9
up:P51553,hsa:3421,IDH3G; isocitrate dehydrogenase (NAD(+)) 3 non-catalytic subunit gamma
up:Q9P2G1,hsa:54467,ANKIB1; ankyrin repeat and IBR domain containing 1
up:P07741,hsa:353,APRT; adenine phosphoribosyltransferase
up:Q9H936,hsa:79751,SLC25A22; solute carrier family 25 member 22
up:Q9BYV1,hsa:64902,AGXT2; alanine--glyoxylate aminotransferase 2
up:Q14957,hsa:2905,GRIN2C; glutamate ionotropic receptor NMDA type subunit 2C
up:O43448,hsa:9196,KCNAB3; potassium voltage-gated channel subfamily A regulatory beta subunit 3
up:P28331,hsa:4719,NDUFS1; NADH:ubiquinone oxidoreductase core subunit S1
up:P53680,hsa:1175,AP2S1; adaptor related protein complex 2 subunit sigma 1
up:P15374,hsa:7347,UCHL3; ubiquitin C-terminal hydrolase L3
up:P15374,hsa:7347,UCHL3; ubiquitin C-terminal hydrolase L3
up:Q9P2M1,hsa:55805,LRP2BP; LRP2 binding protein
up:Q9UKG1,hsa:26060,"APPL1; adaptor protein, phosphotyrosine interacting with PH domain and leucine zipper 1"
up:Q8WTV0,hsa:949,SCARB1; scavenger receptor class B member 1
up:Q9BV86,hsa:28989,NTMT1; N-terminal Xaa-Pro-Lys N-methyltransferase 1
up:Q7Z624,hsa:79823,CAMKMT; calmodulin-lysine N-methyltransferase
up:O14732,hsa:3613,IMPA2; inositol monophosphatase 2
up:O60906,hsa:6610,SMPD2; sphingomyelin phosphodiesterase 2
up:Q9NR63,hsa:56603,CYP26B1; cytochrome P450 family 26 subfamily B member 1
up:Q8IUS5,hsa:253152,EPHX4; epoxide hydrolase 4
up:P16949,hsa:3925,STMN1; stathmin 1
up:P16949,hsa:3925,STMN1; stathmin 1
up:Q8IXV7,hsa:200942,KLHDC8B; kelch domain containing 8B
up:Q96DM3,hsa:29919,RMC1; regulator of MON1-CCZ1
up:P49326,hsa:2330,FMO5; flavin containing dimethylaniline monoxygenase 5
up:Q93100,hsa:5257,PHKB; phosphorylase kinase regulatory subunit beta
up:P09496,hsa:1211,CLTA; clathrin light chain A
up:P09496,hsa:1211,CLTA; clathrin light chain A
up:A6NFH5,hsa:646486,FABP12; fatty acid binding protein 12
up:Q8N8N7,hsa:145482,PTGR2; prostaglandin reductase 2
up:Q96KP1,hsa:55770,EXOC2; exocyst complex component 2
up:Q99798,hsa:50,ACO2; aconitase 2
up:Q9ULR5,hsa:400961,PAIP2B; poly(A) binding protein interacting protein 2B
up:Q6JQN1,hsa:80724,ACAD10; acyl-CoA dehydrogenase family member 10
up:P01111,hsa:4893,"NRAS; NRAS proto-oncogene, GTPase"
up:O75323,hsa:2631,NIPSNAP2; nipsnap homolog 2
up:Q71U36,hsa:7846,TUBA1A; tubulin alpha 1a
up:P04179,hsa:6648,SOD2; superoxide dismutase 2
up:P31040,hsa:6389,SDHA; succinate dehydrogenase complex flavoprotein subunit A
up:Q0VDG4,hsa:79634,SCRN3; secernin 3
up:Q9UFE4,hsa:339829,CCDC39; coiled-coil domain containing 39
up:Q8TD30,hsa:84706,GPT2; glutamic--pyruvic transaminase 2
up:P16152,hsa:873,CBR1; carbonyl reductase 1
up:Q8IVP5,hsa:139341,FUNDC1; FUN14 domain containing 1
up:Q9GZN8,hsa:54976,C20orf27; chromosome 20 open reading frame 27
up:P00387,hsa:1727,CYB5R3; cytochrome b5 reductase 3
up:P19105,hsa:10627,MYL12A; myosin light chain 12A
up:Q96K30,hsa:84934,RITA1; RBPJ interacting and tubulin associated 1
up:Q14254,hsa:2319,FLOT2; flotillin 2
up:Q9UKB3,hsa:56521,DNAJC12; DnaJ heat shock protein family (Hsp40) member C12
up:Q9UHY8,hsa:9637,FEZ2; fasciculation and elongation protein zeta 2
up:Q9UBF6,hsa:9616,RNF7; ring finger protein 7
up:Q9NZJ6,hsa:51805,"COQ3; coenzyme Q3, methyltransferase"
up:O95214,hsa:23484,LEPROTL1; leptin receptor overlapping transcript like 1
up:O14976,hsa:2580,GAK; cyclin G associated kinase
up:Q99732,hsa:9516,LITAF; lipopolysaccharide induced TNF factor
up:Q6DWJ6,hsa:124274,GPR139; G protein-coupled receptor 139
up:Q8IWW8,hsa:137872,ADHFE1; alcohol dehydrogenase iron containing 1
up:Q9H299,hsa:83442,SH3BGRL3; SH3 domain binding glutamate rich protein like 3
up:P34949,hsa:4351,MPI; mannose phosphate isomerase
up:O94889,hsa:23276,KLHL18; kelch like family member 18
up:Q96J02,hsa:83737,ITCH; itchy E3 ubiquitin protein ligase
up:Q9Y6K8,hsa:26289,AK5; adenylate kinase 5
up:Q13569,hsa:6996,TDG; thymine DNA glycosylase
up:Q8N4V1,hsa:93380,MMGT1; membrane magnesium transporter 1
up:Q96EY8,hsa:326625,MMAB; metabolism of cobalamin associated B
up:Q9Y343,hsa:28966,SNX24; sorting nexin 24
up:O43399,hsa:7165,TPD52L2; TPD52 like 2
up:Q8NBH2,hsa:339855,KY; kyphoscoliosis peptidase
up:O15212,hsa:10471,PFDN6; prefoldin subunit 6
up:Q9H3Z4,hsa:80331,DNAJC5; DnaJ heat shock protein family (Hsp40) member C5
up:Q86TX2,hsa:641371,ACOT1; acyl-CoA thioesterase 1
up:P13807,hsa:2997,GYS1; glycogen synthase 1
up:Q71U36,hsa:7846,TUBA1A; tubulin alpha 1a
up:P27701,hsa:3732,CD82; CD82 molecule
up:Q86V87,hsa:64760,FHIP2B; FHF complex subunit HOOK interacting protein 2B
up:Q9Y5X2,hsa:29886,SNX8; sorting nexin 8
up:Q8NFW1,hsa:169044,COL22A1; collagen type XXII alpha 1 chain
up:Q4LDE5,hsa:79987,"SVEP1; sushi, von Willebrand factor type A, EGF and pentraxin domain containing 1"
up:Q86UY8,hsa:51559,NT5DC3; 5'-nucleotidase domain containing 3
up:P62837,hsa:7322,UBE2D2; ubiquitin conjugating enzyme E2 D2
up:Q8N9R8,hsa:286205,SCAI; suppressor of cancer cell invasion
up:Q9Y2S2,hsa:51084,CRYL1; crystallin lambda 1
up:P60709,hsa:60,ACTB; actin beta
up:O43909,hsa:2137,EXTL3; exostosin like glycosyltransferase 3
up:O60760,hsa:27306,HPGDS; hematopoietic prostaglandin D synthase
up:Q9H3G5,hsa:54504,CPVL; carboxypeptidase vitellogenic like
up:Q9UEW3,hsa:8685,MARCO; macrophage receptor with collagenous structure
up:P35270,hsa:6697,SPR; sepiapterin reductase
up:P08670,hsa:7431,VIM; vimentin
up:P22897,hsa:4360,MRC1; mannose receptor C-type 1
up:A5D8V7,hsa:115948,ODAD3; outer dynein arm docking complex subunit 3
up:O00754,hsa:4125,MAN2B1; mannosidase alpha class 2B member 1
up:Q8WX93,hsa:23022,"PALLD; palladin, cytoskeletal associated protein"
up:O75096,hsa:4038,LRP4; LDL receptor related protein 4
up:Q5T013,hsa:81888,HYI; hydroxypyruvate isomerase (putative)
up:Q9HBL0,hsa:7145,TNS1; tensin 1
up:Q02978,hsa:8402,SLC25A11; solute carrier family 25 member 11
up:P11229,hsa:1128,CHRM1; cholinergic receptor muscarinic 1
up:Q15369,hsa:6921,ELOC; elongin C
up:Q13002,hsa:2898,GRIK2; glutamate ionotropic receptor kainate type subunit 2
up:P10515,hsa:1737,DLAT; dihydrolipoamide S-acetyltransferase
up:Q8N475,hsa:56884,FSTL5; follistatin like 5
up:P50583,hsa:318,NUDT2; nudix hydrolase 2
up:Q96A58,hsa:85004,RERG; RAS like estrogen regulated growth inhibitor
up:P40926,hsa:4191,MDH2; malate dehydrogenase 2
up:A0JLT2,hsa:219541,MED19; mediator complex subunit 19
up:Q96AG3,hsa:91137,SLC25A46; solute carrier family 25 member 46
up:P61088,hsa:7334,UBE2N; ubiquitin conjugating enzyme E2 N
up:P32929,hsa:1491,CTH; cystathionine gamma-lyase
up:Q96RP9,hsa:85476,GFM1; G elongation factor mitochondrial 1
up:O75489,hsa:4722,NDUFS3; NADH:ubiquinone oxidoreductase core subunit S3
up:Q86SZ2,hsa:122553,TRAPPC6B; trafficking protein particle complex subunit 6B
up:Q9UBW8,hsa:50813,COPS7A; COP9 signalosome subunit 7A
up:P45880,hsa:7417,VDAC2; voltage dependent anion channel 2
up:P21579,hsa:6857,SYT1; synaptotagmin 1
up:Q9NQR4,hsa:56954,NIT2; nitrilase family member 2
up:P62314,hsa:6632,SNRPD1; small nuclear ribonucleoprotein D1 polypeptide
up:Q9P0T7,hsa:252839,TMEM9; transmembrane protein 9
up:Q99435,hsa:4753,NELL2; neural EGFL like 2
up:P43034,hsa:5048,PAFAH1B1; platelet activating factor acetylhydrolase 1b regulatory subunit 1
up:Q13639,hsa:3360,HTR4; 5-hydroxytryptamine receptor 4
up:O75912,hsa:9162,DGKI; diacylglycerol kinase iota
up:Q92823,hsa:4897,NRCAM; neuronal cell adhesion molecule
up:Q9NS85,hsa:56934,CA10; carbonic anhydrase 10
up:Q9HBX9,hsa:59350,RXFP1; relaxin family peptide receptor 1
up:P23416,hsa:2742,GLRA2; glycine receptor alpha 2
up:O43808,hsa:10478,SLC25A17; solute carrier family 25 member 17
up:O75431,hsa:10651,MTX2; metaxin 2
up:O15072,hsa:9508,ADAMTS3; ADAM metallopeptidase with thrombospondin type 1 motif 3
up:Q9Y6V0,hsa:27445,PCLO; piccolo presynaptic cytomatrix protein
up:Q96HU8,hsa:54769,DIRAS2; DIRAS family GTPase 2
up:Q14691,hsa:9837,GINS1; GINS complex subunit 1
up:Q9P1F3,hsa:58527,ABRACL; ABRA C-terminal like
up:Q8IVL0,hsa:89795,NAV3; neuron navigator 3
up:P39086,hsa:2897,GRIK1; glutamate ionotropic receptor kainate type subunit 1
up:P32418,hsa:6546,SLC8A1; solute carrier family 8 member A1
up:O15072,hsa:9508,ADAMTS3; ADAM metallopeptidase with thrombospondin type 1 motif 3
up:Q9UJ83,hsa:26061,HACL1; 2-hydroxyacyl-CoA lyase 1
up:P08574,hsa:1537,CYC1; cytochrome c1
up:Q16891,hsa:10989,IMMT; inner membrane mitochondrial protein
up:Q5EBL8,hsa:51248,PDZD11; PDZ domain containing 11
up:O75964,hsa:10632,ATP5MG; ATP synthase membrane subunit g
up:Q6PD74,hsa:79719,AAGAB; alpha and gamma adaptin binding protein
up:O60925,hsa:5201,PFDN1; prefoldin subunit 1
up:Q4G0F5,hsa:112936,"VPS26B; VPS26, retromer complex component B"
up:Q9H6F2,hsa:79041,TMEM38A; transmembrane protein 38A
up:Q9BUK0,hsa:79145,CHCHD7; coiled-coil-helix-coiled-coil-helix domain containing 7
up:Q53S33,hsa:388962,BOLA3; bolA family member 3
up:A1Z1Q3,hsa:140733,MACROD2; mono-ADP ribosylhydrolase 2
up:P51513,hsa:4857,NOVA1; NOVA alternative splicing regulator 1
up:P39210,hsa:4358,MPV17; mitochondrial inner membrane protein MPV17
up:Q9Y3D6,hsa:51024,"FIS1; fission, mitochondrial 1"
up:Q9Y3D6,hsa:51024,"FIS1; fission, mitochondrial 1"
up:O95563,hsa:25874,MPC2; mitochondrial pyruvate carrier 2
up:O14530,hsa:10190,TXNDC9; thioredoxin domain containing 9
up:Q9BTX7,hsa:79183,TTPAL; alpha tocopherol transfer protein like
up:Q9P0R6,hsa:51527,GSKIP; GSK3B interacting protein
up:Q8N5X7,hsa:317649,EIF4E3; eukaryotic translation initiation factor 4E family member 3
up:P05166,hsa:5096,PCCB; propionyl-CoA carboxylase subunit beta
up:Q6P2H8,hsa:79639,TMEM53; transmembrane protein 53
up:Q9BTX7,hsa:79183,TTPAL; alpha tocopherol transfer protein like
up:Q02153,hsa:2983,GUCY1B1; guanylate cyclase 1 soluble subunit beta 1
up:Q15631,hsa:7247,TSN; translin
up:Q9NYS0,hsa:28512,NKIRAS1; NFKB inhibitor interacting Ras like 1
up:Q9UBB4,hsa:25814,ATXN10; ataxin 10
up:Q9UBB4,hsa:25814,ATXN10; ataxin 10
up:Q15506,hsa:53340,SPA17; sperm autoantigenic protein 17
up:Q96E17,hsa:115827,"RAB3C; RAB3C, member RAS oncogene family"
up:Q8IVL0,hsa:89795,NAV3; neuron navigator 3
up:Q7RTX9,hsa:151473,SLC16A14; solute carrier family 16 member 14
up:P23763,hsa:6843,VAMP1; vesicle associated membrane protein 1
up:P61106,hsa:51552,"RAB14; RAB14, member RAS oncogene family"
up:Q9P2F6,hsa:57569,ARHGAP20; Rho GTPase activating protein 20
up:Q99715,hsa:1303,COL12A1; collagen type XII alpha 1 chain
up:P13073,hsa:1327,COX4I1; cytochrome c oxidase subunit 4I1
up:Q9Y3A3,hsa:25843,"MOB4; MOB family member 4, phocein"
up:Q13112,hsa:8208,CHAF1B; chromatin assembly factor 1 subunit B
up:Q9UJQ1,hsa:24141,LAMP5; lysosomal associated membrane protein family member 5
up:Q15078,hsa:8851,CDK5R1; cyclin dependent kinase 5 regulatory subunit 1
up:Q96T52,hsa:83943,IMMP2L; inner mitochondrial membrane peptidase subunit 2
up:Q13423,hsa:23530,NNT; nicotinamide nucleotide transhydrogenase
up:Q6UWL6,hsa:84063,KIRREL2; kirre like nephrin family adhesion molecule 2
up:O75340,hsa:10016,PDCD6; programmed cell death 6
up:P22695,hsa:7385,UQCRC2; ubiquinol-cytochrome c reductase core protein 2
up:Q9BV79,hsa:51102,MECR; mitochondrial trans-2-enoyl-CoA reductase
up:Q96LU5,hsa:196294,IMMP1L; inner mitochondrial membrane peptidase subunit 1
up:O75845,hsa:6309,SC5D; sterol-C5-desaturase
up:Q8N0U8,hsa:154807,VKORC1L1; vitamin K epoxide reductase complex subunit 1 like 1
up:Q99807,hsa:10229,"COQ7; coenzyme Q7, hydroxylase"
up:Q13404,hsa:7335,UBE2V1; ubiquitin conjugating enzyme E2 V1
up:O15055,hsa:8864,PER2; period circadian regulator 2
up:Q13404,hsa:7335,UBE2V1; ubiquitin conjugating enzyme E2 V1
up:Q9BZV1,hsa:80700,UBXN6; UBX domain protein 6
up:P19526,hsa:2523,FUT1; fucosyltransferase 1 (H blood group)
up:Q09470,hsa:3736,KCNA1; potassium voltage-gated channel subfamily A member 1
up:Q17RW2,hsa:255631,COL24A1; collagen type XXIV alpha 1 chain
up:P21266,hsa:2947,GSTM3; glutathione S-transferase mu 3
up:P16066,hsa:4881,NPR1; natriuretic peptide receptor 1
up:Q15147,hsa:5332,PLCB4; phospholipase C beta 4
up:Q96G01,hsa:636,BICD1; BICD cargo adaptor 1
up:Q8IYS1,hsa:135293,PM20D2; peptidase M20 domain containing 2
up:Q52WX2,hsa:388228,SBK1; SH3 domain binding kinase 1
up:P31350,hsa:6241,RRM2; ribonucleotide reductase regulatory subunit M2
up:Q15413,hsa:6263,RYR3; ryanodine receptor 3
up:P35498,hsa:6323,SCN1A; sodium voltage-gated channel alpha subunit 1
up:P55011,hsa:6558,SLC12A2; solute carrier family 12 member 2
up:P04818,hsa:7298,TYMS; thymidylate synthetase
up:Q14994,hsa:9970,NR1I3; nuclear receptor subfamily 1 group I member 3
up:P19801,hsa:26,AOC1; amine oxidase copper containing 1
up:Q6UX73,hsa:146556,C16orf89; chromosome 16 open reading frame 89
up:P60709,hsa:60,ACTB; actin beta
up:Q9H1H9,hsa:63971,KIF13A; kinesin family member 13A
up:P21333,hsa:2316,FLNA; filamin A
up:O60503,hsa:115,ADCY9; adenylate cyclase 9
up:Q13972,hsa:5923,RASGRF1; Ras protein specific guanine nucleotide releasing factor 1
up:Q9BRD0,hsa:84811,BUD13; BUD13 homolog
up:Q08499,hsa:5144,PDE4D; phosphodiesterase 4D
up:O94812,hsa:8938,BAIAP3; BAI1 associated protein 3
up:Q9H706,hsa:64762,GAREM1; GRB2 associated regulator of MAPK1 subtype 1
up:Q9BXW6,hsa:114876,OSBPL1A; oxysterol binding protein like 1A
up:O94973,hsa:161,AP2A2; adaptor related protein complex 2 subunit alpha 2
up:P41221,hsa:7474,WNT5A; Wnt family member 5A
up:Q8N6U8,hsa:23432,GPR161; G protein-coupled receptor 161
up:A6NNA5,hsa:644168,DRGX; dorsal root ganglia homeobox
up:A6NNA5,hsa:644168,DRGX; dorsal root ganglia homeobox
up:Q9H611,hsa:80119,PIF1; PIF1 5'-to-3' DNA helicase
up:Q9UMS6,hsa:171024,SYNPO2; synaptopodin 2
up:Q9UQB3,hsa:1501,CTNND2; catenin delta 2
up:Q6V0I7,hsa:79633,FAT4; FAT atypical cadherin 4
up:P31150,hsa:2664,GDI1; GDP dissociation inhibitor 1
up:P0DP25,hsa:808,CALM3; calmodulin 3
up:P0DP25,hsa:808,CALM3; calmodulin 3
up:P0DP25,hsa:808,CALM3; calmodulin 3
up:Q15417,hsa:1266,CNN3; calponin 3
up:P09651,hsa:3178,HNRNPA1; heterogeneous nuclear ribonucleoprotein A1
up:Q06033,hsa:3699,ITIH3; inter-alpha-trypsin inhibitor heavy chain 3
up:Q10469,hsa:4247,"MGAT2; alpha-1,6-mannosyl-glycoprotein 2-beta-N-acetylglucosaminyltransferase"
up:P21589,hsa:4907,NT5E; 5'-nucleotidase ecto
up:Q99643,hsa:6391,SDHC; succinate dehydrogenase complex subunit C
up:P37108,hsa:6727,SRP14; signal recognition particle 14
up:P34981,hsa:7201,TRHR; thyrotropin releasing hormone receptor
up:Q9Y210,hsa:7225,TRPC6; transient receptor potential cation channel subfamily C member 6
up:Q9BTM1,hsa:55766,H2AJ; H2A.J histone
up:P20309,hsa:1131,CHRM3; cholinergic receptor muscarinic 3
